{
  "schemaVersion": 1,
  "keyword": "증시",
  "slug": "0a12747915ef63e8",
  "aliases": [],
  "searchKeywords": [
    "증시"
  ],
  "timezone": "Asia/Seoul",
  "today": "2026-10-24",
  "generatedAt": "2026-10-24T03:00:00Z",
  "daily": [
    {
      "day": "2026-09-25",
      "articleCount": 0,
      "weightedScore": 0.0
    },
    {
      "day": "2026-09-26",
      "articleCount": 0,
      "weightedScore": 0.0
    },
    {
      "day": "2026-09-27",
      "articleCount": 0,
      "weightedScore": 0.0
    },
    {
      "day": "2026-09-28",
      "articleCount": 0,
      "weightedScore": 0.0
    },
    {
      "day": "2026-09-29",
      "articleCount": 0,
      "weightedScore": 0.0
    },
    {
      "day": "2026-09-30",
      "articleCount": 0,
      "weightedScore": 0.0
    },
    {
      "day": "2026-10-01",
      "articleCount": 0,
      "weightedScore": 0.0
    },
    {
      "day": "2026-10-02",
      "articleCount": 0,
      "weightedScore": 0.0
    },
    {
      "day": "2026-10-03",
      "articleCount": 0,
      "weightedScore": 0.0
    },
    {
      "day": "2026-10-04",
      "articleCount": 0,
      "weightedScore": 0.0
    },
    {
      "day": "2026-10-05",
      "articleCount": 0,
      "weightedScore": 0.0
    },
    {
      "day": "2026-10-06",
      "articleCount": 0,
      "weightedScore": 0.0
    },
    {
      "day": "2026-10-07",
      "articleCount": 0,
      "weightedScore": 0.0
    },
    {
      "day": "2026-10-08",
      "articleCount": 0,
      "weightedScore": 0.0
    },
    {
      "day": "2026-10-09",
      "articleCount": 0,
      "weightedScore": 0.0
    },
    {
      "day": "2026-10-10",
      "articleCount": 0,
      "weightedScore": 0.0
    },
    {
      "day": "2026-10-11",
      "articleCount": 0,
      "weightedScore": 0.0
    },
    {
      "day": "2026-10-12",
      "articleCount": 0,
      "weightedScore": 0.0
    },
    {
      "day": "2026-10-13",
      "articleCount": 0,
      "weightedScore": 0.0
    },
    {
      "day": "2026-10-14",
      "articleCount": 0,
      "weightedScore": 0.0
    },
    {
      "day": "2026-10-15",
      "articleCount": 0,
      "weightedScore": 0.0
    },
    {
      "day": "2026-10-16",
      "articleCount": 0,
      "weightedScore": 0.0
    },
    {
      "day": "2026-10-17",
      "articleCount": 0,
      "weightedScore": 0.0
    },
    {
      "day": "2026-10-18",
      "articleCount": 0,
      "weightedScore": 0.0
    },
    {
      "day": "2026-10-19",
      "articleCount": 0,
      "weightedScore": 0.0
    },
    {
      "day": "2026-10-20",
      "articleCount": 0,
      "weightedScore": 0.0
    },
    {
      "day": "2026-10-21",
      "articleCount": 0,
      "weightedScore": 0.0
    },
    {
      "day": "2026-10-22",
      "articleCount": 1,
      "weightedScore": 1.0
    },
    {
      "day": "2026-10-23",
      "articleCount": 0,
      "weightedScore": 0.0
    },
    {
      "day": "2026-10-24",
      "articleCount": 1,
      "weightedScore": 1.1
    }
  ],
  "articles": [
    {
      "id": "article-deb9d8ffad190ff3",
      "title": "고정 기사 14",
      "source": "다음 뉴스",
      "date": "2026-10-24T07:30:00",
      "url": "https://news.example.com/daum/014"
    },
    {
      "id": "article-46ec2c47c1959f31",
      "title": "고정 기사 7",
      "source": "Google News RSS - 환율",
      "date": "2026-10-22T20:00:00",
      "url": "https://news.example.com/rss/007"
    }
  ],
  "evidenceByDay": {
    "2026-10-22": [
      {
        "id": "article-46ec2c47c1959f31",
        "title": "고정 기사 7",
        "summary": "고정 기사 7의 요약입니다.",
        "source": "Google News RSS - 환율",
        "publishedAt": "2026-10-22T20:00:00+09:00",
        "sourceUrl": "https://news.example.com/rss/007"
      }
    ],
    "2026-10-24": [
      {
        "id": "article-deb9d8ffad190ff3",
        "title": "고정 기사 14",
        "summary": "고정 기사 14의 요약입니다.",
        "source": "다음 뉴스",
        "publishedAt": "2026-10-24T07:30:00+09:00",
        "sourceUrl": "https://news.example.com/daum/014"
      }
    ]
  }
}
