{
  "schemaVersion": 1,
  "keyword": "인공지능",
  "slug": "c597b282778e3c88",
  "aliases": [
    "A.I.",
    "AI"
  ],
  "searchKeywords": [
    "A.I.",
    "AI",
    "인공지능"
  ],
  "timezone": "Asia/Seoul",
  "today": "2026-10-24",
  "generatedAt": "2026-10-24T03:00:00Z",
  "daily": [
    {
      "day": "2026-09-25",
      "articleCount": 0,
      "weightedScore": 0.0
    },
    {
      "day": "2026-09-26",
      "articleCount": 0,
      "weightedScore": 0.0
    },
    {
      "day": "2026-09-27",
      "articleCount": 0,
      "weightedScore": 0.0
    },
    {
      "day": "2026-09-28",
      "articleCount": 0,
      "weightedScore": 0.0
    },
    {
      "day": "2026-09-29",
      "articleCount": 0,
      "weightedScore": 0.0
    },
    {
      "day": "2026-09-30",
      "articleCount": 0,
      "weightedScore": 0.0
    },
    {
      "day": "2026-10-01",
      "articleCount": 0,
      "weightedScore": 0.0
    },
    {
      "day": "2026-10-02",
      "articleCount": 0,
      "weightedScore": 0.0
    },
    {
      "day": "2026-10-03",
      "articleCount": 0,
      "weightedScore": 0.0
    },
    {
      "day": "2026-10-04",
      "articleCount": 0,
      "weightedScore": 0.0
    },
    {
      "day": "2026-10-05",
      "articleCount": 0,
      "weightedScore": 0.0
    },
    {
      "day": "2026-10-06",
      "articleCount": 0,
      "weightedScore": 0.0
    },
    {
      "day": "2026-10-07",
      "articleCount": 0,
      "weightedScore": 0.0
    },
    {
      "day": "2026-10-08",
      "articleCount": 0,
      "weightedScore": 0.0
    },
    {
      "day": "2026-10-09",
      "articleCount": 0,
      "weightedScore": 0.0
    },
    {
      "day": "2026-10-10",
      "articleCount": 0,
      "weightedScore": 0.0
    },
    {
      "day": "2026-10-11",
      "articleCount": 0,
      "weightedScore": 0.0
    },
    {
      "day": "2026-10-12",
      "articleCount": 0,
      "weightedScore": 0.0
    },
    {
      "day": "2026-10-13",
      "articleCount": 0,
      "weightedScore": 0.0
    },
    {
      "day": "2026-10-14",
      "articleCount": 0,
      "weightedScore": 0.0
    },
    {
      "day": "2026-10-15",
      "articleCount": 0,
      "weightedScore": 0.0
    },
    {
      "day": "2026-10-16",
      "articleCount": 0,
      "weightedScore": 0.0
    },
    {
      "day": "2026-10-17",
      "articleCount": 0,
      "weightedScore": 0.0
    },
    {
      "day": "2026-10-18",
      "articleCount": 0,
      "weightedScore": 0.0
    },
    {
      "day": "2026-10-19",
      "articleCount": 0,
      "weightedScore": 0.0
    },
    {
      "day": "2026-10-20",
      "articleCount": 0,
      "weightedScore": 0.0
    },
    {
      "day": "2026-10-21",
      "articleCount": 0,
      "weightedScore": 0.0
    },
    {
      "day": "2026-10-22",
      "articleCount": 2,
      "weightedScore": 2.133
    },
    {
      "day": "2026-10-23",
      "articleCount": 3,
      "weightedScore": 3.333
    },
    {
      "day": "2026-10-24",
      "articleCount": 1,
      "weightedScore": 1.1
    }
  ],
  "articles": [
    {
      "id": "article-deb9d8ffad190ff3",
      "title": "고정 기사 14",
      "source": "다음 뉴스",
      "date": "2026-10-24T07:30:00",
      "url": "https://news.example.com/daum/014"
    },
    {
      "id": "article-f860ec6edad33054",
      "title": "고정 기사 13",
      "source": "다음 뉴스",
      "date": "2026-10-23T20:00:00",
      "url": "https://news.example.com/daum/013"
    },
    {
      "id": "article-5de9f33acb99dc6e",
      "title": "고정 기사 12",
      "source": "네이버 뉴스",
      "date": "2026-10-23T16:00:00",
      "url": "https://news.example.com/naver/012"
    },
    {
      "id": "article-50c1bb0696ff7508",
      "title": "고정 기사 11",
      "source": "네이버 뉴스",
      "date": "2026-10-23T14:00:00",
      "url": "https://news.example.com/naver/011"
    },
    {
      "id": "article-e19ec38e7775b8f6",
      "title": "고정 기사 6",
      "source": "네이버 뉴스",
      "date": "2026-10-22T18:00:00",
      "url": "https://news.example.com/naver/006"
    },
    {
      "id": "article-691f6ad4ca71aa93",
      "title": "고정 기사 2",
      "source": "네이버 뉴스",
      "date": "2026-10-22T09:30:00",
      "url": "https://news.example.com/naver/002"
    }
  ],
  "evidenceByDay": {
    "2026-10-22": [
      {
        "id": "article-e19ec38e7775b8f6",
        "title": "고정 기사 6",
        "summary": "고정 기사 6의 요약입니다.",
        "source": "네이버 뉴스",
        "publishedAt": "2026-10-22T18:00:00+09:00",
        "sourceUrl": "https://news.example.com/naver/006"
      },
      {
        "id": "article-691f6ad4ca71aa93",
        "title": "고정 기사 2",
        "summary": "고정 기사 2의 요약입니다.",
        "source": "네이버 뉴스",
        "publishedAt": "2026-10-22T09:30:00+09:00",
        "sourceUrl": "https://news.example.com/naver/002"
      }
    ],
    "2026-10-23": [
      {
        "id": "article-f860ec6edad33054",
        "title": "고정 기사 13",
        "summary": "고정 기사 13의 요약입니다.",
        "source": "다음 뉴스",
        "publishedAt": "2026-10-23T20:00:00+09:00",
        "sourceUrl": "https://news.example.com/daum/013"
      },
      {
        "id": "article-5de9f33acb99dc6e",
        "title": "고정 기사 12",
        "summary": "고정 기사 12의 요약입니다.",
        "source": "네이버 뉴스",
        "publishedAt": "2026-10-23T16:00:00+09:00",
        "sourceUrl": "https://news.example.com/naver/012"
      },
      {
        "id": "article-50c1bb0696ff7508",
        "title": "고정 기사 11",
        "summary": "고정 기사 11의 요약입니다.",
        "source": "네이버 뉴스",
        "publishedAt": "2026-10-23T14:00:00+09:00",
        "sourceUrl": "https://news.example.com/naver/011"
      }
    ],
    "2026-10-24": [
      {
        "id": "article-deb9d8ffad190ff3",
        "title": "고정 기사 14",
        "summary": "고정 기사 14의 요약입니다.",
        "source": "다음 뉴스",
        "publishedAt": "2026-10-24T07:30:00+09:00",
        "sourceUrl": "https://news.example.com/daum/014"
      }
    ]
  }
}
